status_id,status_message,link_name,status_type,status_link,status_published,num_reactions,num_comments,num_shares,num_likes,num_loves,num_wows,num_hahas,num_sads,num_angrys,num_special
109202512458660_1022952924416943,"Ride on the Hawaiian Canoe at the Pageant of the Long Canoes! #AlohaPCC #visitOahu

Learn more: http://www.polynesia.com/day-experience.html",Pageant of the Long Canoes,video,https://www.facebook.com/polynesia2/videos/1022948201084082/,2016-02-26 16:53:36,229,2,54,208,21,0,0,0,0
109202512458660_1022524594459776,Look who came roaming into the Polynesian Cultural Center today!  #roaminggnome,Photos from Polynesian Cultural Center's post,photo,https://www.facebook.com/polynesia2/photos/a.545408045504769.1073741828.109202512458660/1022523854459850/?type=3,2016-02-25 20:41:35,173,2,17,162,10,0,1,0,0
109202512458660_1022448257800743,Let's learn about the Hula from this throwback video. #AlohaPCC #visitoahu,Hawaiian Village (Throwback Thursday),video,https://www.facebook.com/polynesia2/videos/1022448257800743/,2016-02-25 16:54:47,849,13,482,774,66,8,1,0,0
109202512458660_1021660761212826,"We love and support our friends and family in Fiji. 

#AlohaPCC #visitOahu

Learn more: http://www.polynesia.com/",,video,https://www.facebook.com/polynesia2/videos/1021660761212826/,2016-02-24 14:00:19,115,4,18,104,11,0,0,0,0
109202512458660_1021176947927874,"Wait for it.... #AlohaPCC #visitOahu

Learn more: http://www.polynesia.com/",,video,https://www.facebook.com/polynesia2/videos/1021176947927874/,2016-02-23 15:50:23,785,31,172,775,10,0,0,0,0
109202512458660_1020557474656488,"Ia Orana! Did you know that French Polynesia, which includes the islands of Tahiti, are made up of approximately 118 islands? That's a lot of islands!",Tahiti,video,https://www.facebook.com/polynesia2/videos/1020556374656598/,2016-02-22 14:26:37,1958,64,1068,1899,47,11,0,0,0
109202512458660_1019667431412159,Mahalo to the Yelp Elite Squad for visiting the Hukilau Marketplace and the Polynesian Cultural Center.  #yelppcc #yelphawaii #alohapcc,Timeline Photos,photo,https://www.facebook.com/polynesia2/photos/a.145964958782415.24143.109202512458660/1019667431412159/?type=3,2016-02-20 19:58:35,249,5,11,249,0,0,0,0,0
109202512458660_1019106804801555,Visit the Aotearoa Village and we'll be happy to teach you spin the Poi. #AlohaPCC #VisitOahu,Island of Aotearoa at the Pageant of the Long Canoes,video,https://www.facebook.com/polynesia2/videos/1019105201468382/,2016-02-19 14:32:46,420,12,108,416,4,0,0,0,0
109202512458660_1018622871516615,Here's a brief history of Polynesia and their wonderful culture narrated by Cousin Benny. #AlohaPCC #visitOahu,A Brief History of Polynesia,video,https://www.facebook.com/polynesia2/videos/1018622871516615/,2016-02-18 14:34:59,421,10,241,417,4,0,0,0,0
109202512458660_1018024728243096,He could be the next fire walker at the Night Show! #alohaPCC #visitOahu,Fire Walker,video,https://www.facebook.com/polynesia2/videos/1018024728243096/,2016-02-17 14:23:16,134,6,35,127,5,0,2,0,0
109202512458660_1017464461632456,Learn how to Slap dance or Kap dance from Kap! #AlohaPCC #visitOahu,Slap Dance,video,https://www.facebook.com/polynesia2/videos/1017464461632456/,2016-02-16 14:12:20,2617,213,2574,2488,73,5,50,0,0
109202512458660_1014726945239541,"TBT Thursday! Anyone remember braddah from the Tongan Village? #AlohaPCC #visitOahu

Learn more: http://www.polynesia.com/",,video,https://www.facebook.com/polynesia2/videos/1014726945239541/,2016-02-11 15:16:36,2757,133,1632,2558,96,3,100,0,0
109202512458660_1014169405295295,"Witness Maori warriors in training as they spar or as they call it Whiwhi pou tahi. #AlohaPCC #visitOahu

Learn more: http://www.polynesia.com/day-experience.html",Whiwhi pou tahi,video,https://www.facebook.com/polynesia2/videos/1014169405295295/,2016-02-10 14:34:22,122,4,31,122,0,0,0,0,0
109202512458660_1013645402014362,Ohh so that's how you do it! #AlohaPCC #visitOahu,Get a tattoo at the Fijian Village,video,https://www.facebook.com/polynesia2/videos/1013645402014362/,2016-02-09 14:16:57,368,16,76,364,4,0,0,0,0
109202512458660_1013186118726957,"Kiwis are warriors, witness them practice the Ahai (posture). #AlohaPCC #visitOahu

Hit the HD button on the settings for better viewing.",,video,https://www.facebook.com/polynesia2/videos/1013186118726957/,2016-02-08 14:38:24,380,7,72,379,1,0,0,0,0
109202512458660_1009395102439392,Not your local grocery store's shredded coconut. #AlohaPCC #VisitOahu,,video,https://www.facebook.com/polynesia2/videos/1009395102439392/,2016-02-05 14:34:15,769,28,187,763,5,1,0,0,0
109202512458660_1009018945810341,"Deseret News (in Salt Lake City, Utah) published the following LDS-oriented story on the Polynesian Football Hall of Fame Class of 2016 enshrinement activities at the Polynesian Cultural Center on Jan. 30, 2016: http://www.deseretnews.com/article/865646807/Former-BYU-star-Vai-Sikahema-urges-education-honors-family-and-heritage-at-Polynesian-Football-Hall.html","Former BYU star Vai Sikahema urges education, honors family and heritage at Polynesian Football...",link,http://www.deseretnews.com/article/865646807/Former-BYU-star-Vai-Sikahema-urges-education-honors-family-and-heritage-at-Polynesian-Football-Hall.html,2016-02-04 20:10:51,230,0,22,229,1,0,0,0,0
109202512458660_1008899529155616,"Throwback Thursday! Check out this classic PCC video. #AlohaPCC #visitOahu

Learn more: http://www.polynesia.com/day-experience.html",,video,https://www.facebook.com/polynesia2/videos/1008899529155616/,2016-02-04 14:15:01,762,36,553,750,11,0,0,1,0
109202512458660_1007965105915725,"We are grateful to have such wonderful dancers here at PCC. Shout out to all the dancers that make the PCC special and great. Mahalo. 
#visitoahu #AlohaPCC",Pageant of the Long Canoes - Hawaii,video,https://www.facebook.com/polynesia2/videos/1007965105915725/,2016-02-02 15:36:23,1109,48,981,1103,5,0,0,0,1
109202512458660_1007424259303143,"This is awesome! Elvis visited the PCC and made a movie - Paradise, Hawaiian Style. #AlohaPCC #visitoahu",This is my Heaven - Paradise Hawaiian Style,video,https://www.facebook.com/polynesia2/videos/1007424259303143/,2016-02-01 14:36:31,1288,52,984,1244,37,7,0,0,0
109202512458660_1006599912718911,"The induction speeches, given by the Polynesian Football Hall of Fame class of 2016 were insightful, moving, and heart warming.  Many tears were shed as we listened to stores of these great men. They are all truly inspiring.   If you missed it, you can watch the enshrinement ceremony again.

https://livestream.com/polynesia-live-event/events/4755654",Polynesian Football Hall of Fame- Enshrinement Ceremony: by PCC-Livestream,link,https://livestream.com/polynesia-live-event/events/4755654,2016-01-30 21:00:57,91,4,32,91,0,0,0,0,0
109202512458660_1006587782720124,"Polynesian Football Hall of Fame Class of 2016 recipients, family representatives and honorees at the press conference portion of the enshrinement program at the Polynesian Cultural Center on January 30, 2016. (PCC photo by Mike Foley)",Timeline Photos,photo,https://www.facebook.com/polynesia2/photos/a.145964958782415.24143.109202512458660/1006587782720124/?type=3,2016-01-30 20:21:46,43,1,3,43,0,0,0,0,0
109202512458660_1006585526053683,"PCC Theater cast members get ready to share an appropriate Maori haka with the Polynesian Football Hall of Fame Class of 2016 inductees, honorees, family and a sold-out enshrinement program in the Center's Hawaiian Journey Theater on January 30, 2016. (PCC photo by Mike Foley)",Timeline Photos,photo,https://www.facebook.com/polynesia2/photos/a.145964958782415.24143.109202512458660/1006585526053683/?type=3,2016-01-30 20:11:06,55,0,4,55,0,0,0,0,0
109202512458660_1006584999387069,Congratulations to the Polynesian Football Hall of Fame c/o 2016!  #polynesianpride,Photos from Polynesian Cultural Center's post,photo,https://www.facebook.com/polynesia2/photos/a.545408045504769.1073741828.109202512458660/1006584639387105/?type=3,2016-01-30 20:08:42,34,0,0,33,1,0,0,0,0
109202512458660_1006508709394698,,Photos from Polynesian Cultural Center's post,photo,https://www.facebook.com/polynesia2/photos/a.545408045504769.1073741828.109202512458660/1006506639394905/?type=3,2016-01-30 15:58:17,57,0,3,57,0,0,0,0,0
109202512458660_1006501952728707,The inductees are now in the hall of fame.,Photos from Polynesian Cultural Center's post,photo,https://www.facebook.com/polynesia2/photos/a.545408045504769.1073741828.109202512458660/1006501586062077/?type=3,2016-01-30 15:45:58,20,0,0,20,0,0,0,0,0
109202512458660_1006495729395996,See the live stream of the Polynesian Football hall of fame https://livestream.com/polynesia-live-event/2016pfhof-press,Photos from Polynesian Cultural Center's post,photo,https://www.facebook.com/polynesia2/photos/a.545408045504769.1073741828.109202512458660/1006494786062757/?type=3,2016-01-30 15:34:28,12,0,0,12,0,0,0,0,0
109202512458660_1006489466063289,The Polynesian football hall of fame 2016 has officially started. #alohaPCC #visitOahu,,video,https://www.facebook.com/polynesia2/videos/1006489466063289/,2016-01-30 15:16:30,243,4,66,242,1,0,0,0,0
109202512458660_1006488459396723,Our dancers are ready for their performance later for the Polynesian football hall of fame.,Photos from Polynesian Cultural Center's post,photo,https://www.facebook.com/polynesia2/photos/a.545408045504769.1073741828.109202512458660/1006487972730105/?type=3,2016-01-30 15:08:11,68,1,3,68,0,0,0,0,0
109202512458660_1006487916063444,The 2016 Polynesian Football Hall of Fame Press Conference will start shortly.,Timeline Photos,photo,https://www.facebook.com/polynesia2/photos/a.145964958782415.24143.109202512458660/1006487916063444/?type=3,2016-01-30 15:06:47,28,0,3,28,0,0,0,0,0
109202512458660_1006190716093164,Mahalo to New York Jets running back Chris Ivory for taking time out of your busy schedule to visit our Alii Luau. #alohapcc  #visitoahu,Timeline Photos,photo,https://www.facebook.com/polynesia2/photos/a.145964958782415.24143.109202512458660/1006190716093164/?type=3,2016-01-30 00:34:58,108,0,8,108,0,0,0,0,0
109202512458660_1006097562769146,"Tickets for the Polynesian Football Hall of Fame Enshrinement Ceremony have sold out but a limited number of tickets for the Reception Luncheon which include PCC general admission are still available for purchase at the PCC ticket office at 293-3333

For our LIVE STREAM of the event use the links below: 

Press Conference:  https://livestream.com/polynesia-live-event/2016pfhof-press 

Enshrinement Ceremony: https://livestream.com/polynesia-live-event/events/4755654",Timeline Photos,photo,https://www.facebook.com/polynesia2/photos/a.145964958782415.24143.109202512458660/1006097562769146/?type=3,2016-01-29 21:05:35,23,0,4,22,0,1,0,0,0
109202512458660_1005981559447413,"Steelers running back DeAngelo Williams showing off his Tahitian dance moves at our Luau. #AlohaPCC #visitoahu

Video credit: @rose_ifoness",,video,https://www.facebook.com/polynesia2/videos/1005981559447413/,2016-01-29 15:55:57,422,5,76,421,1,0,0,0,0
109202512458660_1005936482785254,"Share stories and history at this year's Polynesian Football Hall of Fame Enshrinement Ceremony at the PCC. 

For ticket information for the 2016 Enshrinement Ceremony visit: www.polynesianfootballhof.org

#AlohaPCC #VisitOahu",Timeline Photos,photo,https://www.facebook.com/polynesia2/photos/a.145964958782415.24143.109202512458660/1005936482785254/?type=3,2016-01-29 14:14:30,27,0,3,27,0,0,0,0,0
109202512458660_1005443946167841,"We are now SOLD OUT for the Polynesian Football Hall of Fame ENSHRINEMENT CEREMONY at the Polynesian Cultural Center!

Tickets are still available for INDUCTEE RECEPTION LUNCHEON at 11:00 AM.",Timeline Photos,photo,https://www.facebook.com/polynesia2/photos/a.145964958782415.24143.109202512458660/1005443946167841/?type=3,2016-01-28 18:57:22,7,0,0,7,0,0,0,0,0
109202512458660_1005375159508053,"Learn about the Maori Haka from our Throwback video. 
#AlohaPCC #visitoahu

Learn more: http://www.polynesia.com/day-experience.html",The Haka,video,https://www.facebook.com/polynesia2/videos/1005375159508053/,2016-01-28 14:15:35,517,15,286,507,8,1,0,0,0
109202512458660_1005362859509283,"The Polynesian Football Hall of Fame Class of 2016 Commemorative Shirts are now available!

Get yours today at http://shop.polynesia.com/decor/hukilau-marketplace1/polynesian-football.html?cat=846",Polynesian Football Hall of Fame,photo,https://www.facebook.com/PolynesianFootballHallOfFame/photos/a.565166953551026.1073741828.534519219949133/1055193531215030/?type=3,2016-01-28 13:50:28,13,0,0,13,0,0,0,0,0
109202512458660_1004895692889333,,Polynesian Cultural Center,photo,https://www.facebook.com/polynesia2/photos/a.133365470042364.20339.109202512458660/1004895692889333/?type=3,2016-01-27 15:36:03,119,4,14,112,6,0,0,0,1
109202512458660_1004863686225867,"Don't forget to get your tickets before they're sold out! For ticket information for the 2016 enshrinement ceremony visit: 

For ticket information for the 2016 enshrinement ceremony visit: www.polynesianfootballhof.org

#AlohaPCC #VisitOahu",Timeline Photos,photo,https://www.facebook.com/polynesia2/photos/a.145964958782415.24143.109202512458660/1004863686225867/?type=3,2016-01-27 14:38:22,20,0,1,20,0,0,0,0,0
109202512458660_1004367792942123,"Let's follow the Samoan canoe. Let's go!
Learn more: http://www.polynesia.com/day-experience.html

#AlohaPCC #VisitOahu",,video,https://www.facebook.com/polynesia2/videos/1004367792942123/,2016-01-26 14:37:28,310,14,92,308,2,0,0,0,0
109202512458660_1003977339647835,"Join us as we honor some of the greatest football players, coaches and contributors of Polynesian decent during the Polynesian Football Hall of Fame Enshrinement Ceremony on Saturday, January 30. #AlohaPCC",Polynesian Cultural Center inducts 2016 Polynesian Football Hall of Fame players,link,http://khon2.com/2016/01/25/polynesian-cultural-center-inducts-2016-polynesian-football-hall-of-fame-players/,2016-01-25 20:29:50,29,0,2,29,0,0,0,0,0
109202512458660_1003850716327164,"This is how to husk a coconut. You just need a sharp stick.
#VisitOahu #AlohaPCC",,video,https://www.facebook.com/polynesia2/videos/1003850716327164/,2016-01-25 14:15:19,374,21,52,372,2,0,0,0,0
109202512458660_1002329483145954,It's awesome to be Kiwi! #AlohaPCC #visitoahu,Timeline Photos,photo,https://www.facebook.com/polynesia2/photos/a.145964958782415.24143.109202512458660/1002329483145954/?type=3,2016-01-22 14:33:13,563,15,48,563,0,0,0,0,0
109202512458660_1001794759866093,"Let our Cultural Ambassador Uncle Benny Kai take you on a ride in this throwback video from the Polynesian Cultural Center. #visitoahu #AlohaPCC

Learn More: http://www.polynesia.com/day-experience.html",Polynesian Cultural Center Tour,video,https://www.facebook.com/polynesia2/videos/1001794759866093/,2016-01-21 15:18:26,599,29,250,596,2,0,0,0,0
109202512458660_1001306743248228,"Let's follow the Royal Hawaiian Court at the Pageant of the Long Canoes. #AlohaPCC #visitoahu

Learn More: http://www.polynesia.com/day-experience.html",,video,https://www.facebook.com/polynesia2/videos/1001306743248228/,2016-01-20 15:00:20,71,1,11,71,0,0,0,0,0
109202512458660_1001305249915044,"Ronnie Stanley will join the Polynesian Football Hall of Fame class of 2016 as the Polynesian College Football Player of the year. 
For ticket information for the 2016 Enshrinement Ceremony visit: www.polynesianfootballhof.org

#VisitOahu #AlohaPCC",Timeline Photos,photo,https://www.facebook.com/polynesia2/photos/a.145964958782415.24143.109202512458660/1001305249915044/?type=3,2016-01-20 14:52:35,17,0,1,16,0,1,0,0,0
109202512458660_1000799579965611,"Noted kumu hula Frank Kawaikapuokalani Hewett joins members of the Puanani Aloha hula group from Nagoya, Japan, and others during the Polynesian Cultural Center's 26th annual Moanikeala Hula Festival in the Hawaiian Village on January 16, 2016. (PCC photo by Mike Foley)",Timeline Photos,photo,https://www.facebook.com/polynesia2/photos/a.145964958782415.24143.109202512458660/1000799579965611/?type=3,2016-01-19 15:13:31,308,6,17,308,0,0,0,0,0
109202512458660_1000792299966339,"Enjoy the taste of Polynesia and visit Prime Dining! It's fancy and delicious at the same time. 
For more info about the menu, visit: http://www.polynesia.com/dining_and_luau.html#.VpVuzZMrK9Y",Timeline Photos,photo,https://www.facebook.com/polynesia2/photos/a.145964958782415.24143.109202512458660/1000792299966339/?type=3,2016-01-19 14:55:18,42,0,8,42,0,0,0,0,0
109202512458660_1000784286633807,"Albert Lolotai became a pioneer for future Polynesian football players by being the first Polynesian to play in the NFL. 
For ticket information for the 2016 Enshrinement Ceremony visit: www.polynesianfootballhof.org

#AlohaPCC #VisitOahu",Timeline Photos,photo,https://www.facebook.com/polynesia2/photos/a.145964958782415.24143.109202512458660/1000784286633807/?type=3,2016-01-19 14:29:19,29,0,8,29,0,0,0,0,0
109202512458660_1000243100021259,"An Arizona Cardinal, Green Bay Packer, Philadelphia Eagle, and Tongan Native, Vai Sikahema will be honored at the Polynesian Football Hall of Fame enshrinement ceremony on 1/30. For ticket information for the 2016 enshrinement ceremony visit: www.polynesianfootballhof.org

#VisitOahu #AlohaPCC",Timeline Photos,photo,https://www.facebook.com/polynesia2/photos/a.145964958782415.24143.109202512458660/1000243100021259/?type=3,2016-01-18 15:20:12,28,0,5,28,0,0,0,0,0
109202512458660_999279280117641,The men of Kawai'ulaokala perform a kahiko.,Timeline Photos,photo,https://www.facebook.com/polynesia2/photos/a.145964958782415.24143.109202512458660/999279280117641/?type=3,2016-01-16 21:52:22,524,12,47,524,0,0,0,0,0
109202512458660_999247523454150,"PCC Kumu Hula Ellen Gay Dela Rosa and Kumu Hula Sunday Mariteragi sit down and talk story with Kumu Hula Frank Kawaikapuokalani Hewett, backstage at this years Moanikeala Festival. #alohaPCC #visitoahu",Timeline Photos,photo,https://www.facebook.com/polynesia2/photos/a.145964958782415.24143.109202512458660/999247523454150/?type=3,2016-01-16 20:35:17,60,0,5,60,0,0,0,0,0
109202512458660_999213773457525,The Moanikeala festival 2016. #alohaPCC #visitoahu,Photos from Polynesian Cultural Center's post,photo,https://www.facebook.com/polynesia2/photos/a.545408045504769.1073741828.109202512458660/999213443457558/?type=3,2016-01-16 18:01:50,79,2,11,79,0,0,0,0,0
109202512458660_999208386791397,Come to the Hawaiian village and see the Moanikeala festival and while you're at it come try some Pai'ai.,,video,https://www.facebook.com/polynesia2/videos/999208386791397/,2016-01-16 17:44:33,104,3,22,103,1,0,0,0,0
109202512458660_999206896791546,Moanikeala festival 2016.,,video,https://www.facebook.com/polynesia2/videos/999206896791546/,2016-01-16 17:40:04,224,4,65,224,0,0,0,0,0
109202512458660_999204913458411,Come see talented Keiki in this year's Moanikeala festival at the Hawaiian village.,,video,https://www.facebook.com/polynesia2/videos/999204913458411/,2016-01-16 17:29:55,66,1,11,66,0,0,0,0,0
109202512458660_999201463458756,Come to PCC and witness the Moanikeala Festival 2016. Performing - ka pa Nani o lilinoe,,video,https://www.facebook.com/polynesia2/videos/999201463458756/,2016-01-16 17:23:17,63,0,12,63,0,0,0,0,0
109202512458660_999129660132603,"Meet Charles Teetai Ane, Jr. offensive lineman for the Detroit Lions from 1953-1959. Of Samoan ancestry, Charles will be honored on Jan 30 along with the other class of 2016 Polynesian Football Hall of Fame inductees. For ticket information for the 2016 Enshrinement Ceremony visit: www.polynesianfootballhof.org. 
#AlohaPCC",Timeline Photos,photo,https://www.facebook.com/polynesia2/photos/a.145964958782415.24143.109202512458660/999129660132603/?type=3,2016-01-16 14:10:48,17,0,3,17,0,0,0,0,0
109202512458660_998621130183456,"""THE FIJIAN MAN"" Coming Soon in Theaters near you. Just kidding... #VisitOahu #AlohaPCC

Learn more: http://www.polynesia.com/day-experience.html",Timeline Photos,photo,https://www.facebook.com/polynesia2/photos/a.145964958782415.24143.109202512458660/998621130183456/?type=3,2016-01-15 14:10:53,28,0,1,28,0,0,0,0,0
109202512458660_998163960229173,Watch our talented Keiki dance the hula at the Moanikeala Hula Festival this Saturday. Event starts at 12PM to 4:30PM at the Hawaiian village. #AlohaPCC #visitoahu,,video,https://www.facebook.com/polynesia2/videos/998163960229173/,2016-01-14 15:31:03,240,10,45,240,0,0,0,0,0
109202512458660_998146453564257,"Flahsback to last years Enshrinement Ceremony where now Tennessee Titan's quarterback Marcus Mariota was named the Polynesian College Football Player of 2015. For ticket information for the 2016 Enshrinement Ceremony visit: www.polynesianfootballhof.org. 
#AlohaPCC",Timeline Photos,photo,https://www.facebook.com/polynesia2/photos/a.145964958782415.24143.109202512458660/998146453564257/?type=3,2016-01-14 14:11:00,65,2,3,65,0,0,0,0,0
109202512458660_993495270696042,"Come visit the Kiwis at Aotearoa Village. They will teach you how to twirl the poi. #AlohaPCC #VisitOahu

Learn More: http://www.polynesia.com/day-experience.html",,video,https://www.facebook.com/polynesia2/videos/993495270696042/,2016-01-13 14:10:01,308,17,81,308,0,0,0,0,0
109202512458660_997260933652809,"Come enjoy the Moanikeala Hula Festival this Saturday (Jan. 16, 2016) at the Hawaiian Village. 

Event starts 12PM to 4:30PM.",Timeline Photos,photo,https://www.facebook.com/polynesia2/photos/a.145964958782415.24143.109202512458660/997260933652809/?type=3,2016-01-12 20:50:00,73,0,7,72,1,0,0,0,0
109202512458660_997100013668901,"Of Hawaiian descent, Rockne Freitas boasts an 11 year career in the NFL. For ticket information for the 2016 Enshrinement Ceremony visit: www.polynesianfootballhof.org.
#AlohaPCC #VisitOahu",Timeline Photos,photo,https://www.facebook.com/polynesia2/photos/a.145964958782415.24143.109202512458660/997100013668901/?type=3,2016-01-12 14:10:54,16,0,2,16,0,0,0,0,0
109202512458660_996620497050186,Our very own legendary and multitalented Kap. We are glad we have him here at the PCC. #VisitOahu #AlohaPCC,Timeline Photos,photo,https://www.facebook.com/polynesia2/photos/a.145964958782415.24143.109202512458660/996620497050186/?type=3,2016-01-11 14:10:56,828,34,59,827,1,0,0,0,0
109202512458660_993480790697490,"This is how Coconut Scraping is done in Samoa. ""You can't help that it shows up in your physique"" 
#VisitOahu #AlohaPCC 

Learn More: http://www.polynesia.com/day-experience.html",,video,https://www.facebook.com/polynesia2/videos/993480790697490/,2016-01-08 14:00:01,601,35,143,598,2,0,1,0,0
109202512458660_994640217248214,"Throwback Thursday! Check out this vintage photo of when Elvis visited the PCC in 1965 to film ""Paradise Hawaiian Style"". He loved the experience! #VisitOahu #AlohaPCC",Timeline Photos,photo,https://www.facebook.com/polynesia2/photos/a.145964958782415.24143.109202512458660/994640217248214/?type=3,2016-01-07 14:02:31,762,32,108,762,0,0,0,0,0
109202512458660_993474380698131,"We have our own Spider-Man in the Samoan Village. Come see him in person when you visit PCC.
#AlohaPCC #VisitOahu 

Learn More: http://www.polynesia.com/day-experience.html",,video,https://www.facebook.com/polynesia2/videos/993474380698131/,2016-01-06 14:00:01,1284,64,493,1219,25,6,34,0,0
109202512458660_993446164034286,"Samoans are known throughout Polynesia as the ""happy people"" because of their enjoyment of life and their good-spirited nature. 
#AlohaPCC #LetHawaiiHappen

Learn More: http://www.polynesia.com/day-experience.html",,video,https://www.facebook.com/polynesia2/videos/993446164034286/,2016-01-05 14:00:01,1682,61,509,1657,22,3,0,0,0
109202512458660_993451100700459,"*BREAKING NEWS*
ARIZONA CARDINALS OFFENSIVE LINEMAN MIKE IUPATI NAMED POLYNESIAN PRO FOOTBALL PLAYER OF THE YEAR",Polynesian Football Hall of Fame,photo,https://www.facebook.com/PolynesianFootballHallOfFame/photos/a.565166953551026.1073741828.534519219949133/1042270792507304/?type=3,2016-01-05 13:54:48,223,3,0,223,0,0,0,0,0
109202512458660_992888160756753,"Autographs, photos and much more! Which Polynesian football stars will you have the chance to meet at this years enshrinement ceremony? For ticket information for the 2016 Enshrinement Ceremony visit: www.polynesianfootballhof.org.
#AloahPCC #visitoahu",Timeline Photos,photo,https://www.facebook.com/polynesia2/photos/a.145964958782415.24143.109202512458660/992888160756753/?type=3,2016-01-04 13:16:03,20,0,0,20,0,0,0,0,0
109202512458660_992006640844905,"Have you visited the Hall of Fame at the PCC? Check out the free exhibit and celebrate the class of 2016 inductees on 1/30. For ticket information for the 2016 Enshrinement Ceremony visit: www.polynesianfootballhof.org.

#AlohaPCC #visitoahu",Timeline Photos,photo,https://www.facebook.com/polynesia2/photos/a.145964958782415.24143.109202512458660/992006640844905/?type=3,2016-01-02 21:50:21,40,2,1,40,0,0,0,0,0
109202512458660_991381974240705,Mahalo to our Ohana all over the world for another great year! Hauoli Makahiki Hou (Happy New Year)!  #AlohaPCC #LetHawaiiHappen,Timeline Photos,photo,https://www.facebook.com/polynesia2/photos/a.145964958782415.24143.109202512458660/991381974240705/?type=3,2016-01-01 15:45:35,1029,26,95,1029,0,0,0,0,0
109202512458660_991035824275320,Things are about to heat up this year at the Vaimatina King of the Streets Firknife Battle... starting NOW at the Hukilau Marketplace!,Hukilau Marketplace,photo,https://www.facebook.com/hukilaumarketplace/photos/a.1555067614764612.1073741829.1428599644078077/1667611793510193/?type=3,2016-01-01 02:06:17,20,0,0,20,0,0,0,0,0
109202512458660_991010784277824,https://www.facebook.com/video.php?v=1107061145971771,Honolulu Star-Advertiser,video,https://www.facebook.com/staradvertiser/videos/1107061145971771/,2016-01-01 01:02:06,31,2,0,30,1,0,0,0,0
