status_id,status_message,link_name,status_type,status_link,status_published,num_reactions,num_comments,num_shares,num_likes,num_loves,num_wows,num_hahas,num_sads,num_angrys,num_special
109202512458660_520471574665083,"ONE OF THE LATEST PHOTO GALLERY SUBMISSIONS: This one from Elaine Pettit with her peers in the Tahitian Village, about 1996-ish:",Timeline Photos,photo,https://www.facebook.com/polynesia2/photos/a.145964958782415.24143.109202512458660/520471551331752/?type=3,2013-04-15 15:09:19,240,8,22,240,0,0,0,0,0
109202512458660_517897971589110,"MORE PHOTOS COMING IN: Here's one of the latest, from about 15 years ago. Mahalo, Ninirei Teruhia-Hammond (center, kneeling) for sharing.",Timeline Photos,photo,https://www.facebook.com/polynesia2/photos/a.145964958782415.24143.109202512458660/517897944922446/?type=3,2013-04-08 15:13:45,211,8,13,211,0,0,0,0,0
109202512458660_517005085011732,"HERE'S THE LATEST PHOTO SUBMITTED ONLINE to our 50th anniversary website: Go to pcc50.com > Sharing > Photo gallery to see links to thousands of old PCC pictures, and submit your own.",Timeline Photos,photo,https://www.facebook.com/polynesia2/photos/a.145964958782415.24143.109202512458660/517005068345067/?type=3,2013-04-06 23:48:44,269,5,17,269,0,0,0,0,0
109202512458660_516659665046274,"The Polynesian Cultural Center presented a beautiful wooden bowl to the President of the Merrie Monarch, Luana Kawelu, in celebration of their 50th Anniversary.  The wooden bowl was over 44 inches in length and carved by Master Carver, Tuione Pulotu, one of the original labor missionaries who helped build the PCC in 1963. From our 'ohana to yours, Happy 50th!",Timeline Photos,photo,https://www.facebook.com/polynesia2/photos/a.145964958782415.24143.109202512458660/516659658379608/?type=3,2013-04-06 03:34:08,240,3,13,240,0,0,0,0,0
109202512458660_516446975067543,"Here's the most recent submission to the pcc50.com > sharing > photo gallery: Junior, on the Tongan canoe. Submit some of your own PCC pix.",Timeline Photos,photo,https://www.facebook.com/polynesia2/photos/a.145964958782415.24143.109202512458660/516446948400879/?type=3,2013-04-05 12:55:12,332,20,49,332,0,0,0,0,0
109202512458660_515840471794860,"FOR MORE PICTURES OF HUI HO'OULU ALOHA — the PCC's hula halau that went to Merrie Monarch, go to pcc50.com > Sharing > Photo Gallery > 3rd Decade. FYI (if you can't recognize them), that's (left-right)  Jay Warren Akoi, Harry Brown, and Cy Bridges.",Timeline Photos,photo,https://www.facebook.com/polynesia2/photos/a.145964958782415.24143.109202512458660/515840451794862/?type=3,2013-04-03 19:25:31,140,14,9,140,0,0,0,0,0
109202512458660_514182405294000,THE FIJIANS help celebrate the official re-opening of the newly renovated Hawaii Village at the Polynesian Cultural Center:,Timeline Photos,photo,https://www.facebook.com/polynesia2/photos/a.145964958782415.24143.109202512458660/514182385294002/?type=3,2013-03-30 23:46:45,394,2,35,394,0,0,0,0,0
109202512458660_514182241960683,"THE TONGANS honor the ""new"" Hawaii Village at the Polynesian Cultural Center, March 29, 2013 — part of the PCC's golden jubilee (1963-2013).",Timeline Photos,photo,https://www.facebook.com/polynesia2/photos/a.145964958782415.24143.109202512458660/514182235294017/?type=3,2013-03-30 23:45:37,325,6,22,325,0,0,0,0,0
109202512458660_514150481963859,The PCC Promo team performs at the Perry & Price morning show to promote the opening of the all new Hawaiian Journey theater.,Timeline Photos,photo,https://www.facebook.com/polynesia2/photos/a.145964958782415.24143.109202512458660/514150468630527/?type=3,2013-03-30 20:52:10,67,0,1,67,0,0,0,0,0
109202512458660_514058951973012,"THE TAHITIANS and other islanders at the Polynesian Cultural Center presented gifts and traditional dances in honor of the official grand re-opening of the Hawaii Village at the Polynesian Cultural Center on March 29, 2013.",Timeline Photos,photo,https://www.facebook.com/polynesia2/photos/a.145964958782415.24143.109202512458660/514058938639680/?type=3,2013-03-30 13:41:29,376,8,30,376,0,0,0,0,0
109202512458660_514058071973100,CHECK OUT THE BRAND-NEW 'ULU SHOP that's also part of the newly renovated Hawaiian Journey Theater — all part of the Polynesian Cultural Center's 50th Anniversary celebration throughout 2013.,Timeline Photos,photo,https://www.facebook.com/polynesia2/photos/a.145964958782415.24143.109202512458660/514058058639768/?type=3,2013-03-30 13:38:28,124,4,4,124,0,0,0,0,0
109202512458660_514057465306494,"John-Raymond Mariteragi helps welcome guests to the premiere of the Polynesian Cultural Center's beautiful new experience, ""HAWAIIAN JOURNEY,"" on March 29, 2013.",Timeline Photos,photo,https://www.facebook.com/polynesia2/photos/a.145964958782415.24143.109202512458660/514057451973162/?type=3,2013-03-30 13:36:52,278,5,19,278,0,0,0,0,0
109202512458660_513896201989287,A CONCERT UNDER THE STARS by the Mana'o Company finished off the Polynesian Cultural Center's celebration of Hawaiian culture and its newest additions — all part of the PCC's 50th anniversary (1963-2013).,Timeline Photos,photo,https://www.facebook.com/polynesia2/photos/a.145964958782415.24143.109202512458660/513896188655955/?type=3,2013-03-30 04:21:21,251,7,11,251,0,0,0,0,0
109202512458660_513895495322691,"The HAWAII VILLAGE CELEBRATION begins with hula, led by PCC cultural expert Cy Bridges (Hawaii Island Manager Raymond Mokiao is seen to the left, behind the dancers).",Timeline Photos,photo,https://www.facebook.com/polynesia2/photos/a.145964958782415.24143.109202512458660/513895481989359/?type=3,2013-03-30 04:16:59,527,18,53,527,0,0,0,0,0
109202512458660_513895021989405,"HAWAII VILLAGE WELCOME: Newly appointed PCC President & CEO P. Alfred Grace (left) and his wife, lead the procession of invited kupuna and VIP guests into the opening celebration of the Center's completely renovated Hawaii Village on March 29, 2013 . . . to the accompaniment of Hawaiian chants and shell trumpeting.",Timeline Photos,photo,https://www.facebook.com/polynesia2/photos/a.145964958782415.24143.109202512458660/513895011989406/?type=3,2013-03-30 04:14:14,300,16,24,300,0,0,0,0,0
109202512458660_513894308656143,"READY TO GREET all the visitors who celebrated the premiere of ""Hawaiian Journey"" and the complete renovation of the PCC's Hawaii Village: Pane Meatoga III (left), PCC eCommerce manager, villagers and Naauao Pane'e (second from right):",Timeline Photos,photo,https://www.facebook.com/polynesia2/photos/a.145964958782415.24143.109202512458660/513894298656144/?type=3,2013-03-30 04:10:56,162,1,8,162,0,0,0,0,0
109202512458660_513893668656207,"SOME GUESTS TRAVELED BY CANOE from the premiere of ""Hawaiian Journey"" on Friday, March 29, 2013, to the opening ceremonies for the Polynesian Cultural Center's completely renovated Hawaii Village.",Timeline Photos,photo,https://www.facebook.com/polynesia2/photos/a.145964958782415.24143.109202512458660/513893658656208/?type=3,2013-03-30 04:07:11,198,4,20,198,0,0,0,0,0
109202512458660_10201072486277910,The people of Samoa perform at the reopening ceremony of the Hawai'ian Village,,video,https://www.facebook.com/polynesia2/videos/10201072486277910/,2013-03-29 23:44:47,311,21,55,311,0,0,0,0,0
109202512458660_513841168661457,Mahalo nui loa to everyone who came out to the grand reopening of the Hawai'ian Village.,Timeline Photos,photo,https://www.facebook.com/polynesia2/photos/a.145964958782415.24143.109202512458660/513841155328125/?type=3,2013-03-29 22:40:40,211,9,10,211,0,0,0,0,0
109202512458660_10151379622154352,The Ali'i and royal court welcome guests to the grand opening of the Hawaiian Journey theater.,,video,https://www.facebook.com/polynesia2/videos/10151379622154352/,2013-03-29 22:34:29,109,8,16,109,0,0,0,0,0
109202512458660_10201071687057930,Uncle Sam Kekauoha of Laie shares his reaction to our new Hawai'ian Journey movie.,,video,https://www.facebook.com/polynesia2/videos/10201071687057930/,2013-03-29 22:10:09,63,8,5,63,0,0,0,0,0
109202512458660_513825025329738,The crowd enters into the new theater for the grand opening of the show.,Timeline Photos,photo,https://www.facebook.com/polynesia2/photos/a.145964958782415.24143.109202512458660/513825018663072/?type=3,2013-03-29 21:16:20,115,3,1,115,0,0,0,0,0
109202512458660_513823848663189,Lenoard Ah You plays the main character in the movie Hawai'ian Journey.,Timeline Photos,photo,https://www.facebook.com/polynesia2/photos/a.145964958782415.24143.109202512458660/513823828663191/?type=3,2013-03-29 21:11:00,147,4,5,147,0,0,0,0,0
109202512458660_513816821997225,"Another star from the Hawai'ian Journey, @Michelle Xuxu posing with Delsa Moe.",Timeline Photos,photo,https://www.facebook.com/polynesia2/photos/a.145964958782415.24143.109202512458660/513816805330560/?type=3,2013-03-29 20:39:29,138,6,3,138,0,0,0,0,0
109202512458660_513816111997296,"Al Harrington, the voice for the Hawai'ian Journey movie, takes time from the festivities to pose with Delsa Moe.",Timeline Photos,photo,https://www.facebook.com/polynesia2/photos/a.145964958782415.24143.109202512458660/513816101997297/?type=3,2013-03-29 20:37:26,277,16,11,277,0,0,0,0,0
109202512458660_513813118664262,"Mahalo to Tana Uema, one of the cast members in Hawai'ian Journey, for coming out to today's event.",Timeline Photos,photo,https://www.facebook.com/polynesia2/photos/a.145964958782415.24143.109202512458660/513813101997597/?type=3,2013-03-29 20:31:30,104,2,5,104,0,0,0,0,0
109202512458660_513812181997689,Chef Hector Morales put together a magnificent spread for today's Hawai'ian Journey Grand Opening.,Timeline Photos,photo,https://www.facebook.com/polynesia2/photos/a.145964958782415.24143.109202512458660/513812171997690/?type=3,2013-03-29 20:26:16,169,8,5,169,0,0,0,0,0
109202512458660_513807415331499,VIPs arriving for the Grand Opening of the Hawaiian village and the New Hawaiian Journey,Timeline Photos,photo,https://www.facebook.com/polynesia2/photos/a.145964958782415.24143.109202512458660/513807405331500/?type=3,2013-03-29 20:02:03,352,11,24,352,0,0,0,0,0
109202512458660_513896858655888,"ACTOR, ENTERTAINER AL HARRINGTON, who has family ties to Laie and is the narrator of the PCC's new immersive cinematic experience, ""Hawaiian Journey,"" called the production script ""inspired. I was touched by it."" He described the premiere and subsequent opening of the completely renovated Hawaii Village as ""a wonderful affair.""",Timeline Photos,photo,https://www.facebook.com/polynesia2/photos/a.145964958782415.24143.109202512458660/513893385322902/?type=3,2013-03-30 04:05:20,182,7,8,182,0,0,0,0,0
109202512458660_10201066681572796,"Vaitau Niu to the group Te Makatu O Oateanui from the island of Ua Huka, Marquesas.  They put on a spectacular performance at our Tahitian village today.",,video,https://www.facebook.com/polynesia2/videos/10201066681572796/,2013-03-28 22:31:25,183,9,34,183,0,0,0,0,0
109202512458660_511102892268618,"Mayor Kirk Caldwell presented President Alfred Grace with a proclamation recognizing the PCC's 50th Anniversary and proclaiming Oct. 12, 2013 Polynesian Cultural Center Day.",50th Anniversary Proclamation Presentation,photo,https://www.facebook.com/polynesia2/photos/a.511102385602002.1073741825.109202512458660/511102422268665/?type=3,2013-03-22 20:51:05,93,0,3,93,0,0,0,0,0
109202512458660_508834319162142,"REMEMBER US? Here are a few familiar faces from 20 years ago at the PCC. At least one of them still works at the Center today. They're just a few of the thousands of memorable pictures now found in the pcc50.com galleries. SEND IN SOME OF YOUR OLD PHOTOS, TOO.",Timeline Photos,photo,https://www.facebook.com/polynesia2/photos/a.145964958782415.24143.109202512458660/508834305828810/?type=3,2013-03-18 14:22:28,187,8,5,187,0,0,0,0,0
109202512458660_507005936011647,"The Polynesian Cultural Center's Ha: Breath of Life show was voted, ""Best Live Performance"" by readers of Honolulu Magazine.  Mahalo to everyone who voted!",Timeline Photos,photo,https://www.facebook.com/polynesia2/photos/a.145964958782415.24143.109202512458660/507005926011648/?type=3,2013-03-13 22:36:20,198,11,14,198,0,0,0,0,0
109202512458660_507007552678152,PCC Maori performers send off Hawaiian Airlines inaugural flight to Auckland with an energetic haka this morning at Honolulu International Airport. MEAN. MAORI MEAN!,"Mar 13, 2013 5:00pm",video,https://www.facebook.com/polynesia2/videos/10151356605469352/,2013-03-13 22:00:29,1260,76,231,1260,0,0,0,0,0
109202512458660_506681132710794,"FROM THE PCC50.COM PHOTO GALLERIES: John ""John-O"" Olszowka (right) was so perfect in this early 1980s night show number, ""I want to learn to talk Hawaiian,"" with Carolyn Purcell (left), that many people thought he was an actual tourist who came on stage and didn't realize he is of Polish-Hawaiian extraction. THE PCC — STILL DELIGHTFUL AFTER  50 YEARS.",Timeline Photos,photo,https://www.facebook.com/polynesia2/photos/a.145964958782415.24143.109202512458660/506681119377462/?type=3,2013-03-13 13:07:31,231,28,13,231,0,0,0,0,0
109202512458660_506494669396107,"FIVE YEARS AGO: The Polynesian Cultural Center's annual Maori kapa haka competition — absolutely thrilling; and this year's event in conjunction with PCC's 50th Anniversary will be even more spectacular, especially since it will be held on the two days immediately preceding the Alumni Golden Jubilee Reunion (September 1-8, 2013). Join us if you can; register online.",Timeline Photos,photo,https://www.facebook.com/polynesia2/photos/a.145964958782415.24143.109202512458660/506494659396108/?type=3,2013-03-13 04:19:05,260,6,23,260,0,0,0,0,0
109202512458660_505771656135075,,Polynesian Cultural Center's cover photo,photo,https://www.facebook.com/polynesia2/photos/a.342802635765312.74584.109202512458660/505771586135082/?type=3,2013-03-11 14:53:19,539,27,39,538,1,0,0,0,0
109202512458660_505242309521343,"15 YEARS AGO: Can you name these Tahitian Village people? (Hint, Edouard Tama, upper left, submitted the photo). These and thousands of old PCC pictures can be found in our Golden anniversary website photo gallery at pcc50.com.",Timeline Photos,photo,https://www.facebook.com/polynesia2/photos/a.145964958782415.24143.109202512458660/505242292854678/?type=3,2013-03-10 13:20:06,182,15,13,182,0,0,0,0,0
109202512458660_10200109068828353,More video from today's Ho'olaule'a.,,video,https://www.facebook.com/polynesia2/videos/10200109068828353/,2013-02-24 02:04:22,46,0,5,46,0,0,0,0,0
109202512458660_498997836812457,Mana and Lani from the Cast of HA take the stage in a Tahitian Celebration.,,video,https://www.facebook.com/polynesia2/videos/10200109052147936/,2013-02-24 02:00:02,161,10,13,161,0,0,0,0,0
109202512458660_498910343487873,The Cast of HA performs at the Kamehameha Ho'olaule'a.,Timeline Photos,photo,https://www.facebook.com/polynesia2/photos/a.145964958782415.24143.109202512458660/498910336821207/?type=3,2013-02-23 19:54:52,265,4,4,265,0,0,0,0,0
109202512458660_10151320452964352,The cast of Ha Breath of Life perform a sneak peak on Hawaii News Now to promote their feature performance at the Kamehameha Schools Ho'olaulea this Saturday Feb 23 at 11:15 am on the KS grounds.,,video,https://www.facebook.com/polynesia2/videos/10151320452964352/,2013-02-21 13:41:17,240,19,47,240,0,0,0,0,0
109202512458660_495543777157863,Mahalo to all the happy Valentine's Day couples.,Timeline Photos,photo,https://www.facebook.com/polynesia2/photos/a.145964958782415.24143.109202512458660/495543770491197/?type=3,2013-02-15 01:39:28,138,6,1,138,0,0,0,0,0
109202512458660_495541737158067,Everyone dancing the night away!,Timeline Photos,photo,https://www.facebook.com/polynesia2/photos/a.145964958782415.24143.109202512458660/495541727158068/?type=3,2013-02-15 01:23:45,135,2,4,135,0,0,0,0,0
109202512458660_495537997158441,Touch of Gold on Stage now!,Timeline Photos,photo,https://www.facebook.com/polynesia2/photos/a.145964958782415.24143.109202512458660/495537990491775/?type=3,2013-02-15 01:02:44,91,2,2,91,0,0,0,0,0
109202512458660_495524963826411,Happy Valentine's Day everyone!,Timeline Photos,photo,https://www.facebook.com/polynesia2/photos/a.145964958782415.24143.109202512458660/495524957159745/?type=3,2013-02-15 00:13:58,95,0,3,95,0,0,0,0,0
109202512458660_495521100493464,Want to feel the romance? You can enjoy the canoe ride.,Timeline Photos,photo,https://www.facebook.com/polynesia2/photos/a.145964958782415.24143.109202512458660/495521087160132/?type=3,2013-02-14 23:59:41,310,2,16,310,0,0,0,0,0
109202512458660_495518210493753,Our romantic canoe ride is launching right now!,Timeline Photos,photo,https://www.facebook.com/polynesia2/photos/a.145964958782415.24143.109202512458660/495518187160422/?type=3,2013-02-14 23:46:24,124,5,1,124,0,0,0,0,0
109202512458660_495509377161303,Don't forget to try our Roasted pork!,Timeline Photos,photo,https://www.facebook.com/polynesia2/photos/a.145964958782415.24143.109202512458660/495509363827971/?type=3,2013-02-14 23:21:02,196,12,12,196,0,0,0,0,0
109202512458660_495505200495054,"Delsa Moe, opening up the evening!",Timeline Photos,photo,https://www.facebook.com/polynesia2/photos/a.145964958782415.24143.109202512458660/495505193828388/?type=3,2013-02-14 23:15:53,80,6,0,80,0,0,0,0,0
109202512458660_495492867162954,10 more minutes till we start! Be ready to have a romantic night with your special someone.,Timeline Photos,photo,https://www.facebook.com/polynesia2/photos/a.145964958782415.24143.109202512458660/495492857162955/?type=3,2013-02-14 22:35:33,391,17,18,391,0,0,0,0,0
109202512458660_495559570489617,To all the happy couples Happy Valentine's Day!,Valentine's Day Dinner & Concert 2013,photo,https://www.facebook.com/polynesia2/photos/a.495559253822982.105554.109202512458660/495559260489648/?type=3,2013-02-15 03:05:38,42,0,1,42,0,0,0,0,0
109202512458660_495359143842993,"30 YEARS AGO (from the pcc50.com ""publications"" and photo gallery sections): The late William K. Wallace II, a former Moloka'i fire chief and father of the late William K. Wallace III of Laie, was named ""chief"" of the Polynesian Cultural Center's Hawaiian Village.",Timeline Photos,photo,https://www.facebook.com/polynesia2/photos/a.145964958782415.24143.109202512458660/495359137176327/?type=3,2013-02-14 14:14:02,78,3,5,78,0,0,0,0,0
109202512458660_495119950533579,"Mark and Laura Willes, holding a Hawaiian o'o (digging tool), after the November 6, 2007, groundbreaking for the new halau wa'a (canoe compound) in the PCC's Hawaiian Village that eight months later would become the home of Iosepa, BYU-Hawaii's 57-foot twin-hulled sailing canoe.

The Willeses were major benefactors behind the project. He also served on the Polynesian Cultural Center Board of Directors for 13 years, and is a former president of the Latter-day Saint Hawaii-Honolulu Mission. She recently wrote the book ""Miracle in the Pacific,"" that came out in December 2012 in time for the PCC's 50th anniversary.",Timeline Photos,photo,https://www.facebook.com/polynesia2/photos/a.145964958782415.24143.109202512458660/495119940533580/?type=3,2013-02-13 22:53:40,108,1,1,108,0,0,0,0,0
109202512458660_495006940544880,"5 YEARS AGO AT THE PCC:  President & CEO Von D. Orgill, at the community reception for the brand-new Kauaiwiulaokalani canoe halau in the Hawaiian Village, June 27, 2008 (photo by Mike Foley)",Timeline Photos,photo,https://www.facebook.com/polynesia2/photos/a.145964958782415.24143.109202512458660/495006933878214/?type=3,2013-02-13 15:28:20,58,0,3,58,0,0,0,0,0
109202512458660_494607287251512,"15 YEARS AGO: Steve Young took time from his 1998 Pro Bowl schedule in Honolulu to visit Laie and speak for 45 minutes to friends, fans and family in the Polynesian Cultural Center's Aloha Theater.

He regaled the audience with anecdotes from his football career, starting at age eight when his mother scolded an opponent for knocking the wind out of him with a hard tackle. As quarterback of the San Francisco 49ers who led his team to victory in the 1995 Super Bowl, earning the MVP award in the process, he said his opponents are still hitting him hard.

""I love the idea of the Polynesian Cultural Center, because culture is something we all need to hang on to,"" he said. He joked he wished there were also a culture center where defensive linemen could develop a little more sensitivity.",Timeline Photos,photo,https://www.facebook.com/polynesia2/photos/a.145964958782415.24143.109202512458660/494607257251515/?type=3,2013-02-12 18:54:57,226,3,12,226,0,0,0,0,0
109202512458660_494589180586656,"10 YEARS AGO: PCC dancer Tiffany Ieremia, 17, the daughter of PCC alumni Filipo and Dawn Ieremia of Laie, scored a page in the June 2003 nationwide issue of Seventeen Magazine:

Tiffany was part of a PCC Promo Team on tour in New York City that year when the magazine featured her beautiful smile and love of hula, which she and her sisters learned from her mother. ""For me, dancing the hula is really special — more than just an after-school job. It's something that I love to do and part of my culture that I want to continue.""

That's the aloha spirit of our people at the Polynesian Cultural Center: Celebrating our 50th Anniversary throughout 2013.",Timeline Photos,photo,https://www.facebook.com/polynesia2/photos/a.145964958782415.24143.109202512458660/494589153919992/?type=3,2013-02-12 17:45:47,218,10,11,218,0,0,0,0,0
109202512458660_494571740588400,"Coach Olaso's Ambassador fine dining feedback, continued with prime rib, clam chowder, teriyaki chicken, red potato, coconut fish, kalbi short ribs. ONO!",Timeline Photos,photo,https://www.facebook.com/polynesia2/photos/a.145964958782415.24143.109202512458660/494571727255068/?type=3,2013-02-12 16:42:48,209,5,9,209,0,0,0,0,0
109202512458660_494571163921791,"Coach Olaso really enjoyed the Prime Dining portion of his Ambassador experience at the Polynesian Cultural Center, that included Korean mussels, crab legs, California roll, futomaki sushi, sushi salad, and more. Thanks for reminding us, Coach:",Timeline Photos,photo,https://www.facebook.com/polynesia2/photos/a.145964958782415.24143.109202512458660/494571127255128/?type=3,2013-02-12 16:41:09,229,9,21,229,0,0,0,0,0
109202512458660_494971343881773,"Here's a glimpse at our preparations for our Valentine's Day Dinner & Dance.  Don't wait, call 293-3333 to purchase your tickets.",Polynesian Cultural Center's Valentine's Day Dinner & Dance Event,video,https://www.facebook.com/polynesia2/videos/10200745717428893/,2013-02-12 22:29:11,85,23,24,85,0,0,0,0,0
109202512458660_494355437276697,"Check out the more than 3,000 photos already posted to our pcc50.com Golden Anniversary website galleries, such as this one from the 2010 Te Manahua Festival of (left-right) Kim Makekau, Mark Clawson and Kimo DeCaires . . . and consider submitting some of your own!",Timeline Photos,photo,https://www.facebook.com/polynesia2/photos/a.145964958782415.24143.109202512458660/494355400610034/?type=3,2013-02-12 05:10:23,209,3,6,209,0,0,0,0,0
109202512458660_492827064096201,Mahalo for visiting us!,Polynesian Cultural Center Ohana,photo,https://www.facebook.com/polynesia2/photos/a.484057281639846.104235.109202512458660/492825860762988/?type=3,2013-02-08 19:54:53,128,7,7,128,0,0,0,0,0
109202512458660_492786150766959,PCC's Promotional Team visits the famous Sapporo.,さっぽろ雪まつり,photo,https://www.facebook.com/polynesia2/photos/a.491860820859492.104985.109202512458660/492785817433659/?type=3,2013-02-08 17:51:37,357,14,27,357,0,0,0,0,0
109202512458660_492771657435075,"Polynesian Cultural Center President & CEO Von D. Orgill (left) and his wife, Sherri, being entertained by the Tongan Village during their ""graduation"" part on January 18, 2013. Latter-day Saint Church leaders have called President Orgill, who has headed the PCC for approximately 13 years, to serve as president of an English-speaking mission, although they have not yet announced his specific assignment. The Orgills will leave Laie in about a month. He is the long-serving president of the Polynesian Cultural Center.",Timeline Photos,photo,https://www.facebook.com/polynesia2/photos/a.145964958782415.24143.109202512458660/492771640768410/?type=3,2013-02-08 17:01:10,289,22,23,289,0,0,0,0,0
109202512458660_492769037435337,"Speaking on behalf of all the Polynesian Cultural Center employees recognized on February 1, 2013, for their years of service, Fetu'u Falevai — a 40-year veteran originally from Tonga — said he thinks of the PCC as his ""second home.""",Timeline Photos,photo,https://www.facebook.com/polynesia2/photos/a.145964958782415.24143.109202512458660/492769017435339/?type=3,2013-02-08 16:50:07,174,4,5,174,0,0,0,0,0
109202512458660_491861497526091,札幌からアロハ,さっぽろ雪まつり,photo,https://www.facebook.com/polynesia2/photos/a.491860820859492.104985.109202512458660/491860854192822/?type=3,2013-02-06 15:02:11,357,14,27,357,0,0,0,0,0
109202512458660_484057954973112,Mahalo for visiting us!,Polynesian Cultural Center Ohana,photo,https://www.facebook.com/polynesia2/photos/a.484057281639846.104235.109202512458660/484057291639845/?type=3,2013-01-25 20:29:43,128,7,7,128,0,0,0,0,0
109202512458660_483627298349511,,Polynesian Cultural Center's cover photo,photo,https://www.facebook.com/polynesia2/photos/a.342802635765312.74584.109202512458660/483627268349514/?type=3,2013-01-24 21:39:26,45,6,13,45,0,0,0,0,0
109202512458660_482492781796296,Behind the Scenes,2013 Moanike'ala Festival,photo,https://www.facebook.com/polynesia2/photos/a.482491825129725.104054.109202512458660/482491855129722/?type=3,2013-01-22 19:51:34,201,4,13,201,0,0,0,0,0
109202512458660_482480955130812,,Polynesian Cultural Center's cover photo,photo,https://www.facebook.com/polynesia2/photos/a.342802635765312.74584.109202512458660/396661910379384/?type=3,2013-01-22 19:23:42,600,57,34,596,4,0,0,0,0
